Name,Age,Gender,Email,Address,City,Country,Company,Hobby,CreditCard,CVV
Fay Parrish,46,o,lobortis@Donecnibh.co.uk,"P.O. Box 607, 3465 Faucibus Avenue",Hof,Lithuania,Fermentum Metus Institute,"nibh. Aliquam ornare, libero at",4532 2089 2825 0156,877
Jasper Hyde,17,O,neque.pellentesque@semegestas.ca,211-2516 Suspendisse St.,Jodoigne,"Saint Helena, Ascension and Tristan da Cunha",Ligula Donec Luctus Institute,eu erat semper rutrum. Fusce,490685 191853 0604,501
Calvin Glenn,58,M,feugiat@dui.co.uk,Ap #728-394 Aliquam Av.,Perk,Georgia,Est Arcu Incorporated,mauris blandit mattis. Cras eget,4778271534377295,489
Norman Golden,53,A,tincidunt@mollisPhasellus.edu,"P.O. Box 212, 5875 Magna Ave",Sherbrooke,Saint Pierre and Miquelon,Tincidunt Institute,iaculis aliquet diam. Sed diam,4539230797006,247
Melissa Miles,71,M,sit.amet.massa@quamquis.com,"Ap #905-4892 Consectetuer, St.",Kailua,Cape Verde,At Auctor Company,inceptos hymenaeos. Mauris ut quam,4716 9844 9389 7609,438
Reed Hatfield,65,M,Integer.vitae@elitelitfermentum.edu,262-1254 Metus St.,Kulti-Barakar,Australia,Et Ipsum Cursus Corporation,urna. Nullam lobortis quam a,4024 007 15 6702,427
Cadman Munoz,45,M,vulputate.nisi@Quisqueliberolacus.co.uk,843 Nunc St.,Nowshera,Bahamas,Id Industries,"elit, pellentesque a, facilisis non,",4716 2297 7354 8740,329
Emerson Juarez,30,o,tincidunt.pede@fringillacursuspurus.net,Ap #492-3709 Varius Rd.,Sint-Denijs-Westrem,Honduras,Libero Incorporated,"a, malesuada id, erat. Etiam",4485026975614,503
Nina Campos,8,I,interdum@nuncsit.net,"205-4802 Et, Av.",Arviat,Taiwan,Non Lorem Vitae Foundation,"aliquam iaculis, lacus pede sagittis",453 23819 61308 544,485
Jason Bailey,38,u,pretium@Sedauctorodio.org,"P.O. Box 252, 3323 Ut St.",Nowshera,Japan,Ante Limited,orci. Phasellus dapibus quam quis,453 28650 23576 056,643
Fritz Vega,22,M,aliquet.metus@Morbi.org,"P.O. Box 802, 5962 Consectetuer Rd.",Völkermarkt,Spain,Nullam Ltd,eu eros. Nam consequat dolor,4532261895278,945
Rogan Bennett,49,e,venenatis.a@eleifendvitaeerat.org,"P.O. Box 397, 7564 At St.",Trujillo,Dominica,Malesuada Fringilla Est Corp.,"id sapien. Cras dolor dolor,",453924 432737 7756,489
Erin Lucas,14,M,Morbi.quis@Etiam.net,Ap #976-4126 Dictum Av.,Lincoln,Kyrgyzstan,Augue Id Ante LLC,"risus. In mi pede, nonummy",499240 181358 1123,506
Garth Downs,8,M,parturient.montes.nascetur@fringillapurusmauris.net,1030 Magna. St.,Nanaimo,Denmark,Lectus Nullam Limited,"imperdiet nec, leo. Morbi neque",4532302733092299,566
Kitra Wiley,34,M,tellus@scelerisque.net,"P.O. Box 596, 7796 Habitant Road",Andong,Jamaica,Adipiscing Elit Aliquam Inc.,orci. Donec nibh. Quisque nonummy,453 79532 60179 878,583
Giacomo Hawkins,55,I,fermentum.vel@rutrum.net,Ap #656-7671 Scelerisque Av.,Grand Rapids,Cyprus,Gravida Praesent Corporation,"convallis in, cursus et, eros.",4024007149756,248
Ulric Thornton,29,M,Integer@idenimCurabitur.co.uk,"P.O. Box 959, 1012 Ante Avenue",Coquimbo,United Arab Emirates,Lacinia Mattis Corporation,ligula. Aenean gravida nunc sed,4929 292 81 4965,202
Bethany Faulkner,66,i,nibh.Phasellus@metus.com,"P.O. Box 398, 2351 Nullam Rd.",Paju,Timor-Leste,Nunc Sed Pede Corp.,mauris ut mi. Duis risus,4485 6767 9187 6769,137
Nigel Jefferson,72,M,lacus.pede.sagittis@ametrisus.org,6109 Molestie St.,Verkhny Ufaley,Solomon Islands,Nunc Inc.,ad litora torquent per conubia,4716 424 27 7926,425
Xenos Baird,54,M,ut.mi.Duis@semmollis.edu,Ap #683-6425 Adipiscing. Rd.,Charsadda,Rwanda,Mi Tempor Ltd,nec tempus mauris erat eget,4024 007 15 9318,240
Kim Pratt,22,M,Donec.egestas.Duis@magna.edu,6100 Lectus Street,Presles,Germany,Morbi Non Limited,"scelerisque, lorem ipsum sodales purus,",453902 6942184943,244
Holmes Norman,31,M,sapien.Cras@dui.net,995-9004 Risus. Road,Monguelfo-Tesido/Welsberg-Taisten,Mali,Duis Corp.,"dolor sit amet, consectetuer adipiscing",4556 6165 6836 0047,938
Baker Wade,35,M,tellus.id.nunc@pharetraut.co.uk,Ap #756-2005 Egestas Rd.,Dortmund,Mali,Sed Pede Associates,"ante dictum mi, ac mattis",402 40071 91049 815,333
Zorita Jimenez,83,M,vestibulum@lacus.co.uk,750-6450 Feugiat. Ave,Marche-les-Dames,Timor-Leste,Proin Company,"molestie pharetra nibh. Aliquam ornare,",4539 413 10 2099,972
Maxine Estrada,40,u,vehicula.risus@Integerinmagna.co.uk,"P.O. Box 484, 8197 Orci Rd.",Baddeck,Aruba,Nec Quam Corporation,fringilla est. Mauris eu turpis.,448 54300 93542 392,176
Kaye Buckner,56,M,dui.in@nibhvulputatemauris.co.uk,312-5019 Vehicula. Rd.,Casper,Gibraltar,A Malesuada Id Incorporated,"pharetra, felis eget varius ultrices,",4916 783 88 8509,127
Ayanna Hughes,70,o,fermentum@dictumcursus.com,Ap #599-2343 Augue St.,Bay Roberts,Sweden,Libero Est Congue LLP,"est ac mattis semper, dui",4716 7715 1987 1399,651
Giselle Vinson,65,i,Integer.aliquam@liberoProinsed.ca,Ap #750-9650 Eu Street,Todi,Greece,Vel Nisl Company,"leo, in lobortis tellus justo",4716878705570,178
Emerson Stout,10,E,sem@Nuncquis.org,Ap #336-7566 Mauris St.,Khotkovo,Qatar,Leo PC,Aliquam erat volutpat. Nulla facilisis.,448 56077 99881 717,225
Sheila Wolfe,63,A,enim.mi@dictum.co.uk,"944-8096 Orci, Avenue",Pitalito,Slovakia,Sagittis Nullam Vitae Limited,"facilisis non, bibendum sed, est.",453907 120069 7764,399
Cara Fulton,36,M,egestas.Fusce.aliquet@neque.ca,"Ap #948-8567 Sed, St.",Tarbes,Cuba,Neque Nullam Nisl Corporation,"nunc est, mollis non, cursus",4024007133986801,980
Alice Heath,45,o,quis.diam@enim.edu,"P.O. Box 291, 3886 Vestibulum Rd.",Nieuwkerken-Waas,Singapore,Cras Eu Tellus Limited,tempor diam dictum sapien. Aenean,4593278338249,149
Yvette Schmidt,56,M,sed.libero@DonecegestasDuis.co.uk,369-8742 Donec Avenue,Saint-Urbain,Russian Federation,Enim Diam LLP,ligula. Nullam enim. Sed nulla,4916 881 96 7940,416
Lillith Butler,61,M,fermentum.arcu@Donecfelisorci.ca,"P.O. Box 165, 9140 Euismod St.",Riksingen,Benin,Vel Vulputate Company,"sem, consequat nec, mollis vitae,",4916572308341927,744
Neville Levine,3,u,eu.neque.pellentesque@pede.com,"P.O. Box 420, 6978 Mi Rd.",Werder,Rwanda,Ipsum LLC,Mauris molestie pharetra nibh. Aliquam,471623 442641 2542,904
Tiger Long,7,A,augue@penatibusetmagnis.co.uk,"P.O. Box 292, 8545 Eu, Street",Cercemaggiore,"Saint Helena, Ascension and Tristan da Cunha",Libero Lacus Associates,"ante. Maecenas mi felis, adipiscing",4929684795053,999
Kaden Reilly,68,i,eget.metus@cubiliaCuraePhasellus.ca,883-9209 Eu Rd.,Valda,Costa Rica,Enim Corporation,nec metus facilisis lorem tristique,453 25057 94821 204,733
Darius Henderson,83,O,sociis.natoque@metussit.org,"P.O. Box 811, 1747 Commodo Road",Bègles,Mongolia,Ac LLP,volutpat. Nulla facilisis. Suspendisse commodo,4556 267 08 0122,260
Lilah Fields,50,O,neque@odiovel.ca,Ap #132-364 Donec Avenue,Grand Rapids,Mauritius,Proin Vel Arcu Consulting,"non, egestas a, dui. Cras",4716 304 99 8070,918
Raya Santana,75,O,Praesent.eu@lobortis.co.uk,Ap #938-8781 Amet Street,Ciénaga,Mauritius,Amet Foundation,justo. Praesent luctus. Curabitur egestas,4539908408470686,382
Graham Hunter,8,e,ut@eu.ca,"P.O. Box 268, 8544 Arcu. St.",Kędzierzyn-Koźle,Zambia,Dis Parturient Montes Ltd,bibendum fermentum metus. Aenean sed,4532 0346 1001 1940,259
Nasim Britt,7,M,sed.libero@Curabituregestas.org,Ap #131-9759 Fermentum St.,Ingolstadt,Bouvet Island,Egestas Ligula Nullam Industries,quam quis diam. Pellentesque habitant,4539 355 24 2861,440
Montana Burton,63,M,quis@rutrumeu.ca,"P.O. Box 933, 2357 Orci St.",Liverpool,Belgium,Dis Parturient Montes Associates,"libero est, congue a, aliquet",4608984149556030,929
Lareina Chaney,61,o,felis.Donec@lacus.ca,"P.O. Box 491, 7639 Non Road",Chiniot,"Korea, North",Aliquet Proin PC,mattis. Integer eu lacus. Quisque,4716 552 85 1443,449
Quentin Farmer,6,E,erat.semper@neceuismod.ca,937-6779 Sem Rd.,Solihull,Qatar,Nec Ante Maecenas Consulting,"auctor quis, tristique ac, eleifend",4024007193374,713
Wayne Griffin,35,M,felis.purus@quis.co.uk,1336 Orci St.,Maracanaú,Hungary,Eget Institute,sem magna nec quam. Curabitur,453201 025438 0304,225
Zenaida Juarez,33,M,vel.arcu.Curabitur@etmagnis.co.uk,465-5029 Torquent Road,Inverbervie,Zimbabwe,Fermentum Risus At PC,"ornare, libero at auctor ullamcorper,",4929930282948,434
Trevor Pratt,62,M,adipiscing@posuere.net,Ap #659-4566 Lacus. Rd.,Bovigny,Israel,Dui Quis Corp.,orci. Donec nibh. Quisque nonummy,4485 490 61 6066,370
Herrod Manning,14,M,eros@mi.net,252-2524 Eleifend Street,Pierrefonds,Bangladesh,A Neque Consulting,"semper, dui lectus rutrum urna,",4539466380089,483
Kareem Maddox,53,M,nisi@vulputate.com,"P.O. Box 845, 1161 Curabitur St.",Arsoli,Guernsey,Morbi Associates,"velit in aliquet lobortis, nisi",453938 065513 0308,835
Deacon Ellison,46,M,eu.arcu.Morbi@elit.net,316-9428 Non Av.,Pierrefonds,Mongolia,Curabitur Egestas PC,"nunc nulla vulputate dui, nec",4916 452 61 6710,799
Chaim Beach,38,E,mattis@ornaretortorat.com,2583 In St.,Mamuju,Algeria,Donec Limited,et ultrices posuere cubilia Curae;,4024007162726,966
Jeanette Nixon,40,O,libero@aliquamarcuAliquam.com,"Ap #583-9876 Montes, Road",Devon,Australia,Morbi Accumsan Laoreet Limited,"dis parturient montes, nascetur ridiculus",4916788115627,645
Lucas Mclean,15,M,accumsan.interdum@risus.edu,7222 Nullam Street,Muzaffargarh,Mayotte,Ornare Institute,"risus varius orci, in consequat",4531820553964,208
Wing Mcdaniel,60,I,Mauris.nulla.Integer@nequevitae.net,"P.O. Box 414, 7833 Orci Rd.",GŽrouville,Chad,Accumsan Consulting,"purus, accumsan interdum libero dui",4024 007 15 5803,714
Juliet Lewis,52,M,fermentum.arcu@Proinvel.net,108-7395 Primis Avenue,Sapele,Armenia,Justo Eu Arcu Consulting,"metus. In lorem. Donec elementum,",471618 6389576848,863
Octavius Yang,34,A,Fusce.mi.lorem@rutrumnonhendrerit.ca,Ap #102-7205 Eu Road,Manchester,Tunisia,Enim Suspendisse Aliquet PC,tristique senectus et netus et,453 92287 22947 461,413
Reece Bradley,84,M,dapibus@vitaenibhDonec.co.uk,203-9132 Dolor St.,Ottignies-Louvain-la-Neuve,Switzerland,Aliquam Nisl Nulla Associates,Fusce aliquet magna a neque.,4716 990 76 9025,579
Venus Zimmerman,78,I,eget.metus@nulla.org,Ap #180-1365 Hendrerit Road,Fort Resolution,Bahrain,Mauris Magna LLC,"fringilla, porttitor vulputate, posuere vulputate,",4485535752223,506
Justin Schwartz,59,e,nisi@aliquetlibero.edu,"667-6662 A, Road",Edmonton,Mongolia,Blandit Viverra Donec Associates,tincidunt nibh. Phasellus nulla. Integer,4556 305 08 1819,725
Riley Aguirre,33,M,posuere@pharetrautpharetra.net,Ap #231-1861 Ridiculus Rd.,Amelia,Tonga,Porta Elit A Corp.,arcu imperdiet ullamcorper. Duis at,4916 904 30 4626,439
Carolyn Slater,44,O,consequat.nec@ametmassaQuisque.co.uk,"P.O. Box 196, 4471 Convallis Rd.",Verdun,Georgia,Nunc Pulvinar Company,Donec nibh. Quisque nonummy ipsum,4539 233 71 6516,741
Graham Ellis,80,M,egestas@Aliquameratvolutpat.co.uk,513-7717 Orci Street,College,Viet Nam,Euismod Enim Etiam Company,enim. Nunc ut erat. Sed,4485 732 39 8259,134
Hedley Stokes,23,M,parturient@eget.edu,"P.O. Box 571, 3663 Porttitor Rd.",Pointe-au-Pic,Cameroon,Urna Suscipit Nonummy PC,"mollis. Phasellus libero mauris, aliquam",4716 449 60 2454,151
Eve Charles,18,e,Morbi.accumsan@egetmetuseu.co.uk,560-9471 Massa. Street,Fort St. John,"Korea, North",Eu Sem Pellentesque Corp.,fringilla euismod enim. Etiam gravida,455603 6441674169,321
Irma Stephens,82,E,dolor@erosNam.edu,"Ap #549-2997 Ante, Road",Thorold,Japan,Urna Suscipit Nonummy LLC,eros nec tellus. Nunc lectus,402400 719997 3610,688
Walker Kidd,39,M,nascetur.ridiculus@cursus.ca,Ap #757-5604 Ac St.,Mount Pearl,"Virgin Islands, British",Sed Turpis LLP,"lorem fringilla ornare placerat, orci",4556167621652,775
Veronica Scott,11,M,elit@volutpatornare.edu,Ap #673-1783 Dui. Avenue,As,Georgia,Orci Tincidunt Adipiscing LLC,"at auctor ullamcorper, nisl arcu",4702296549063,782
Chloe Schneider,4,M,habitant.morbi@ligula.edu,"P.O. Box 179, 6532 Nisl St.",Kashmore,Canada,Ac Limited,"id, ante. Nunc mauris sapien,",492 91873 68886 391,667
Fuller Ortega,27,M,eget.ipsum.Suspendisse@sit.net,"P.O. Box 654, 6671 Sit Road",Santa Coloma de Gramenet,Monaco,Erat Associates,consectetuer mauris id sapien. Cras,453208 5000594218,233
Flynn Bird,51,M,Duis.sit@diam.com,5077 Consequat St.,St. John's,Laos,Elementum Purus Accumsan Institute,"vestibulum lorem, sit amet ultricies",4532 921 69 9987,840
Ashton Bates,70,U,dictum.magna@nisl.org,9279 Nibh. Avenue,Bazzano,Burkina Faso,Aliquam Eu Associates,tincidunt vehicula risus. Nulla eget,4024007122787,395
Abigail Gilliam,76,M,eget.venenatis@nec.co.uk,"3074 Et, Av.",Phoenix,Svalbard and Jan Mayen Islands,Quisque Libero Lacus PC,eu enim. Etiam imperdiet dictum,4539647916645,935
Mary Winters,65,i,Morbi.neque@vellectus.org,"P.O. Box 107, 1214 Sed Street",Campinas,Lithuania,Est Corp.,Aenean gravida nunc sed pede.,492 90881 45955 683,950
Christopher Lancaster,71,U,dignissim.lacus@Donec.edu,"273-3825 Vel, Ave",Ciénaga,Nauru,Molestie Sodales Mauris Industries,dolor vitae dolor. Donec fringilla.,4556 050 71 9381,129
Trevor Rhodes,73,i,Curae@urnajustofaucibus.org,356-7210 Iaculis Street,Svobodny,Guinea,Magna Et Incorporated,eget magna. Suspendisse tristique neque,4154920667525,201
Ramona Benton,13,M,Nulla@egestasnuncsed.net,2955 Mauris Rd.,Kaaskerke,Curaçao,Placerat Velit Quisque Associates,"non magna. Nam ligula elit,",434400 033400 6662,236
Kim Mckee,22,e,Donec@feugiatLorem.co.uk,Ap #995-511 Aenean Street,Koekelberg,Bulgaria,At Foundation,"nisi nibh lacinia orci, consectetuer",4929 344 36 6352,492
Dennis Buchanan,38,O,pede.et@Inornare.com,112-2385 Nulla Road,Santa Maria,Albania,Vitae Sodales Incorporated,erat. Vivamus nisi. Mauris nulla.,492 94586 78281 890,282
Virginia Moreno,31,M,auctor@mollislectus.co.uk,7814 Vel St.,Verdun,Nigeria,Mi Aliquam Associates,habitant morbi tristique senectus et,4539884806913,671
Gretchen Vincent,81,I,per.conubia.nostra@augue.org,8481 Eros Avenue,Arrah,Viet Nam,Nulla Associates,"in aliquet lobortis, nisi nibh",4716 183 05 5042,801
Morgan Good,8,M,mauris@morbitristique.net,473-9445 Luctus Street,Llanquihue,Taiwan,Metus Eu Erat Associates,"aliquet diam. Sed diam lorem,",440959 7295463024,963
Deirdre Harrell,30,M,eget.dictum@Aliquamvulputateullamcorper.org,932-6371 Elit. Road,Stockholm,Turkey,Justo Nec Ante PC,euismod est arcu ac orci.,438315 039646 0000,720
Olivia Mcmahon,50,M,luctus.sit@non.com,4415 In Street,Whithorn,Saint Barthélemy,Ante Nunc Mauris Industries,volutpat nunc sit amet metus.,455686 3603719874,750
Merritt Dominguez,62,M,nunc.sit@vitaenibh.org,"P.O. Box 170, 3469 Semper. Rd.",Sciacca,India,Vulputate Lacus Cras LLP,Praesent luctus. Curabitur egestas nunc,4982534215057433,655
Hayfa Garner,74,a,in.lobortis@metus.org,7476 Velit. St.,Yaroslavl,Belize,Semper Consulting,"sapien, cursus in, hendrerit consectetuer,",4716 450 38 9058,689
Gil Spence,13,M,Sed@auctorquistristique.org,"P.O. Box 494, 6033 Eget Avenue",Heide,Timor-Leste,Est Ac Company,auctor velit. Aliquam nisl. Nulla,4716 788 07 5544,251
Martina Hull,15,o,per.inceptos.hymenaeos@congueIn.ca,"P.O. Box 352, 3857 Accumsan Rd.",Kohat,Ghana,Ultrices Posuere LLP,"Donec elementum, lorem ut aliquam",453 98258 11381 930,579
Norman Kidd,25,M,vulputate.lacus@nec.ca,"P.O. Box 797, 692 Ligula. Street",Grande Cache,Guinea,Sed Pede Foundation,"non, bibendum sed, est. Nunc",4556963934754,896
Belle Henderson,13,M,sem.elit@neque.com,202-9026 Vitae Street,Grand-Hallet,Senegal,Tempus Inc.,tincidunt vehicula risus. Nulla eget,402400 7199656405,770
Talon Bullock,72,e,eget.laoreet.posuere@euismodmauriseu.net,384-7372 At Rd.,Sgonico,Mexico,Mollis Nec Foundation,"justo faucibus lectus, a sollicitudin",4539 513 75 8345,159
Rebekah Poole,25,E,dolor.Nulla.semper@Loremipsumdolor.com,Ap #850-6694 Sit Avenue,Cali,"Virgin Islands, United States",A Facilisis Non Corp.,"Phasellus nulla. Integer vulputate, risus",4916617691547679,728
Jackson Lindsey,37,M,ut.pellentesque@nisl.edu,Ap #162-7759 Aliquam Rd.,Oevel,Switzerland,Quisque Varius Corp.,"sed, est. Nunc laoreet lectus",4539 418 63 1233,440
Isabelle Gibson,52,M,quis.massa@sagittisDuis.co.uk,6703 Ut Ave,Vitacura,French Southern Territories,Nulla Limited,faucibus orci luctus et ultrices,4485 207 96 3223,795
Ryder Glenn,35,A,sapien.Cras@magnaNamligula.edu,384-7884 Pulvinar St.,Castor,Curaçao,Ligula Eu Enim Institute,"lectus convallis est, vitae sodales",4532601241134,580
Lacey Middleton,22,M,dolor.Fusce@non.org,6555 Diam. Street,Andacollo,British Indian Ocean Territory,Vestibulum Ante PC,odio sagittis semper. Nam tempor,489789 8139114065,154
Harper Cook,85,O,hendrerit@fringilla.edu,"P.O. Box 253, 4009 Felis, Rd.",Farciennes,Antarctica,Ultricies Adipiscing Enim Consulting,"enim mi tempor lorem, eget",4556 8337 0927 9040,658
Ivan Calderon,84,M,non@vitaevelit.co.uk,Ap #973-6680 Arcu. Street,Prestatyn,Western Sahara,Ac Mattis Consulting,"mauris elit, dictum eu, eleifend",4556542647836,928
Jesse Acosta,62,M,aliquet.diam@dolordolortempus.edu,"670-9310 Vel, Ave",Novo Hamburgo,Greenland,Libero Est Limited,consectetuer euismod est arcu ac,4485 206 06 7299,925
Jarrod Joyner,38,M,Nulla.eu.neque@Cum.com,"P.O. Box 989, 2258 Pellentesque Road",Pointe-au-Pic,United States Minor Outlying Islands,Fringilla Porttitor Vulputate LLP,"sit amet, consectetuer adipiscing elit.",4024007164672,966
